Park Code,Park Name,Category,Category Sort,Order,Family,Taxon Code,TSN,Taxon Record Status,Scientific Name,Common Names,Synonyms,Occurrence
YOSE,Yosemite National Park,Vascular Plant,6,Fabales,Fabaceae,96126,192568,Active,Astragalus lentiginosus var. ineptus,"freckled milkvetch, homely milkvetch",,Present
YOSE,Yosemite National Park,Vascular Plant,6,Fabales,Fabaceae,96427,192718,Active,Astragalus purshii var. lectulus,"Sierran milkvetch, woollypod milkvetch",,Present
YOSE,Yosemite National Park,Vascular Plant,6,Fabales,Fabaceae,97855,192804,Active,Astragalus whitneyi var. whitneyi,"balloonpod milkvetch, Whitney's milkvetch",,Present
YOSE,Yosemite National Park,Vascular Plant,6,Fabales,Fabaceae,123833,25783,Active,Cercis occidentalis,California redbud,,Present
YOSE,Yosemite National Park,Vascular Plant,6,Fabales,Fabaceae,161251,503051,Active,Hoita macrostachya,large leather-root,,Present
YOSE,Yosemite National Park,Vascular Plant,6,Fabales,Fabaceae,291956,566443,Active,Lathyrus jepsonii var. californicus,California pea,,Present
YOSE,Yosemite National Park,Vascular Plant,6,Fabales,Fabaceae,214938,528688,Active,Lathyrus lanszwertii var. aridus,Nevada pea,,Present
YOSE,Yosemite National Park,Vascular Plant,6,Fabales,Fabaceae,214943,528690,Active,Lathyrus lanszwertii var. lanszwertii,"Lanszwert's pea, Lanszwert's peavine",,Probably Present
YOSE,Yosemite National Park,Vascular Plant,6,Fabales,Fabaceae,123914,25856,Active,Lathyrus latifolius,"everlasting peavine, everlasting-pea, perennial pea, perennial peavine, perennial sweetpea",,Present
YOSE,Yosemite National Park,Vascular Plant,6,Fabales,Fabaceae,158045,-502509,Inactive,Lathyrus nevadensis var. nevadensis,,,Present
YOSE,Yosemite National Park,Vascular Plant,6,Fabales,Fabaceae,124610,25880,Active,Lathyrus sulphureus,"snub pea, sulfur pea",,Present
YOSE,Yosemite National Park,Vascular Plant,6,Fabales,Fabaceae,211370,528914,Active,Lotus argophyllus var. fremontii,Fremont's birdsfoot trefoil,,Present
YOSE,Yosemite National Park,Vascular Plant,6,Fabales,Fabaceae,211380,528919,Active,Lotus crassifolius var. crassifolius,big deervetch,Lotus crassifolius,Present
YOSE,Yosemite National Park,Vascular Plant,6,Fabales,Fabaceae,128243,26390,Active,Lotus micranthus,desert deervetch,,Present
YOSE,Yosemite National Park,Vascular Plant,6,Fabales,Fabaceae,211404,528930,Active,Lotus nevadensis var. nevadensis,"Nevada bird's-foot trefoil, Nevada trefoil",,Present
YOSE,Yosemite National Park,Vascular Plant,6,Fabales,Fabaceae,211408,528932,Active,Lotus oblongifolius var. oblongifolius,"streambank bird's-foot trefoil, streambank trefoil",,Present
YOSE,Yosemite National Park,Vascular Plant,6,Fabales,Fabaceae,211420,528938,Active,Lotus scoparius var. scoparius,common deerweed,,Present
YOSE,Yosemite National Park,Vascular Plant,6,Fabales,Fabaceae,128260,26405,Active,Lotus strigosus,"Bishop's lotus, strigose bird's-foot trefoil, strigose bird's-foot-trefoil",,Present
YOSE,Yosemite National Park,Vascular Plant,6,Fabales,Fabaceae,124661,25926,Active,Lupinus adsurgens,Drew's silky lupine,,Present
YOSE,Yosemite National Park,Vascular Plant,6,Fabales,Fabaceae,124664,25929,Active,Lupinus albicaulis,sicklekeel lupine,,Present
YOSE,Yosemite National Park,Vascular Plant,6,Fabales,Fabaceae,211448,528951,Active,Lupinus albifrons var. albifrons,silver lupine,,Present
YOSE,Yosemite National Park,Vascular Plant,6,Fabales,Fabaceae,124671,25935,Active,Lupinus andersonii,Anderson's lupine,,Probably Present
YOSE,Yosemite National Park,Vascular Plant,6,Fabales,Fabaceae,124678,25941,Active,Lupinus arbustus,"longspur lupine, spurred lupine",,Present
YOSE,Yosemite National Park,Vascular Plant,6,Fabales,Fabaceae,291975,566452,Active,Lupinus argenteus var. heteranthus,,,Present
YOSE,Yosemite National Park,Vascular Plant,6,Fabales,Fabaceae,232690,537012,Active,Lupinus argenteus var. meionanthus,Lake Tahoe lupine,,Present
YOSE,Yosemite National Park,Vascular Plant,6,Fabales,Fabaceae,124704,25965,Active,Lupinus benthamii,spider lupine,,Present
YOSE,Yosemite National Park,Vascular Plant,6,Fabales,Fabaceae,124705,25966,Active,Lupinus bicolor,"bicolor lupine, miniature lupine",,Present
YOSE,Yosemite National Park,Vascular Plant,6,Fabales,Fabaceae,212854,528963,Active,Lupinus breweri var. breweri,Brewer's lupine,,Present
YOSE,Yosemite National Park,Vascular Plant,6,Fabales,Fabaceae,212856,528964,Active,Lupinus breweri var. bryoides,matted lupine,,Present
YOSE,Yosemite National Park,Vascular Plant,6,Fabales,Fabaceae,212858,528965,Active,Lupinus breweri var. grandiflorus,matted lupine,,Present
YOSE,Yosemite National Park,Vascular Plant,6,Fabales,Fabaceae,162964,503579,Active,Lupinus covillei,shaggy lupine,,Present
YOSE,Yosemite National Park,Vascular Plant,6,Fabales,Fabaceae,212898,528984,Active,Lupinus formosus var. formosus,summer lupine,,Present
YOSE,Yosemite National Park,Vascular Plant,6,Fabales,Fabaceae,125565,26018,Active,Lupinus fulcratus,greenstipule lupine,,Present
YOSE,Yosemite National Park,Vascular Plant,6,Fabales,Fabaceae,125569,26021,Active,Lupinus gracilentus,green slender lupine,,Present
YOSE,Yosemite National Park,Vascular Plant,6,Fabales,Fabaceae,125570,26022,Active,Lupinus grayi,"Gray's lupine, Sierra lupine",,Present
YOSE,Yosemite National Park,Vascular Plant,6,Fabales,Fabaceae,233249,537087,Active,Lupinus latifolius var. columbianus,,,Present
YOSE,Yosemite National Park,Vascular Plant,6,Fabales,Fabaceae,233964,537108,Active,Lupinus lepidus var. confertus,,,Present
YOSE,Yosemite National Park,Vascular Plant,6,Fabales,Fabaceae,233971,537111,Active,Lupinus lepidus var. lobbii,,,Present
YOSE,Yosemite National Park,Vascular Plant,6,Fabales,Fabaceae,233975,537113,Active,Lupinus lepidus var. ramosus,,,Present
YOSE,Yosemite National Park,Vascular Plant,6,Fabales,Fabaceae,233977,537114,Active,Lupinus lepidus var. sellulus,,,Present
YOSE,Yosemite National Park,Vascular Plant,6,Fabales,Fabaceae,291981,566455,Active,Lupinus microcarpus var. densiflorus,,,Present
YOSE,Yosemite National Park,Vascular Plant,6,Fabales,Fabaceae,125623,26070,Active,Lupinus nanus,"annual lupine, sky lupine",,Present
YOSE,Yosemite National Park,Vascular Plant,6,Fabales,Fabaceae,228309,537157,Active,Lupinus polyphyllus var. burkei,,,Present
YOSE,Yosemite National Park,Vascular Plant,6,Fabales,Fabaceae,212940,529003,Active,Lupinus pratensis var. pratensis,Inyo Meadow lupine,,Present
YOSE,Yosemite National Park,Vascular Plant,6,Fabales,Fabaceae,126462,26103,Active,Lupinus rivularis,riverbank lupine,,Probably Present
YOSE,Yosemite National Park,Vascular Plant,6,Fabales,Fabaceae,126487,26126,Active,Lupinus stiversii,harlequin annual lupine,,Present
YOSE,Yosemite National Park,Vascular Plant,6,Fabales,Fabaceae,158887,503721,Active,Medicago lupulina,"black medic, black medic clover, black medick, hop clover, hop medic, nonesuch, yellow trefoil",,Present
YOSE,Yosemite National Park,Vascular Plant,6,Fabales,Fabaceae,158895,503725,Active,Medicago polymorpha,"bur clover, bur medick, burclover, California burclover, toothed medick",,Present
YOSE,Yosemite National Park,Vascular Plant,6,Fabales,Fabaceae,94869,183623,Active,Medicago sativa,alfalfa,,Present
YOSE,Yosemite National Park,Vascular Plant,6,Fabales,Fabaceae,126512,26149,Active,Melilotus alba,white sweetclover,,Present
YOSE,Yosemite National Park,Vascular Plant,6,Fabales,Fabaceae,126516,26152,Active,Melilotus indica,sourclover,,Present
YOSE,Yosemite National Park,Vascular Plant,6,Fabales,Fabaceae,126514,26150,Active,Melilotus officinalis,"cornilla real, field melilot, ribbed melilot, yellow sweetclover, yellow sweet-clover",,Present
YOSE,Yosemite National Park,Vascular Plant,6,Fabales,Fabaceae,161145,-503000,Active,Trifolium albopurpureum var. albopurpureum,,,Present
YOSE,Yosemite National Park,Vascular Plant,6,Fabales,Fabaceae,127266,26228,Active,Trifolium bolanderi,parasol clover,,Present
YOSE,Yosemite National Park,Vascular Plant,6,Fabales,Fabaceae,127269,26230,Active,Trifolium breweri,forest clover,,Present
YOSE,Yosemite National Park,Vascular Plant,6,Fabales,Fabaceae,127273,26234,Active,Trifolium ciliolatum,foothill clover,,Present
YOSE,Yosemite National Park,Vascular Plant,6,Fabales,Fabaceae,127274,26235,Active,Trifolium cyathiferum,cup clover,,Present
YOSE,Yosemite National Park,Vascular Plant,6,Fabales,Fabaceae,126575,26205,Active,Trifolium dubium,"hop clover, smallhop clover, suckling clover",,Present
YOSE,Yosemite National Park,Vascular Plant,6,Fabales,Fabaceae,220724,530731,Active,Trifolium gracilentum var. gracilentum,pinpoint clover,,Present
YOSE,Yosemite National Park,Vascular Plant,6,Fabales,Fabaceae,241386,541419,Active,Trifolium longipes var. nevadense,,,Present
YOSE,Yosemite National Park,Vascular Plant,6,Fabales,Fabaceae,127330,26286,Active,Trifolium microcephalum,"littlehead clover, smallhead clover, small-head clover",,Present
YOSE,Yosemite National Park,Vascular Plant,6,Fabales,Fabaceae,241420,541435,Active,Trifolium monanthum var. grantianum,,,Probably Present
YOSE,Yosemite National Park,Vascular Plant,6,Fabales,Fabaceae,161149,-503002,Active,Trifolium monanthum var. monanthum,mountain carpet clover,Trifolium monanthum ssp. monanthum,Present
YOSE,Yosemite National Park,Vascular Plant,6,Fabales,Fabaceae,127344,26299,Active,Trifolium obtusiflorum,clammy clover,,Present
YOSE,Yosemite National Park,Vascular Plant,6,Fabales,Fabaceae,127347,26300,Active,Trifolium oliganthum,fewflower clover,,Present
YOSE,Yosemite National Park,Vascular Plant,6,Fabales,Fabaceae,127361,26313,Active,Trifolium pratense,red clover,,Present
YOSE,Yosemite National Park,Vascular Plant,6,Fabales,Fabaceae,126576,26206,Active,Trifolium repens,"Dutch clover, ladino clover, white clover, white Dutch clover",,Present
YOSE,Yosemite National Park,Vascular Plant,6,Fabales,Fabaceae,127375,26326,Active,Trifolium variegatum,"whitetip clover, white-tip clover",,Present
YOSE,Yosemite National Park,Vascular Plant,6,Fabales,Fabaceae,127363,26315,Active,Trifolium willdenovii,tomcat clover,,Present
YOSE,Yosemite National Park,Vascular Plant,6,Fabales,Fabaceae,162635,505586,Active,Trifolium wormskioldii,"cow clover, cows clover, Sierra clover",,Present
YOSE,Yosemite National Park,Vascular Plant,6,Fabales,Fabaceae,161218,-503035,Inactive,Vicia americana var. americana,,,Present
YOSE,Yosemite National Park,Vascular Plant,6,Fabales,Fabaceae,127383,26333,Active,Vicia benghalensis,"purple vetch, reddish tufted vetch",,Present
YOSE,Yosemite National Park,Vascular Plant,6,Fagales,Betulaceae,92015,181889,Active,Alnus incana ssp. tenuifolia,"mountain alder, speckled alder, thinleaf alder",,Present
YOSE,Yosemite National Park,Vascular Plant,6,Fagales,Betulaceae,102729,19473,Active,Alnus rhombifolia,"rhombie leaf alder, white alder",,Present
YOSE,Yosemite National Park,Vascular Plant,6,Fagales,Betulaceae,212123,527499,Active,Corylus cornuta var. californica,"California hazel, California hazelnut",,Present
YOSE,Yosemite National Park,Vascular Plant,6,Fagales,Fagaceae,171329,508098,Active,Chrysolepis sempervirens,"bush chinquapin, Sierra chinkapin",,Present
YOSE,Yosemite National Park,Vascular Plant,6,Fagales,Fagaceae,210652,528835,Active,Lithocarpus densiflorus var. echinoides,tanoak,,Present
YOSE,Yosemite National Park,Vascular Plant,6,Fagales,Fagaceae,100601,19312,Active,Quercus chrysolepis,canyon live oak,,Present
YOSE,Yosemite National Park,Vascular Plant,6,Fagales,Fagaceae,101509,19322,Active,Quercus douglasii,blue oak,,Present
YOSE,Yosemite National Park,Vascular Plant,6,Fagales,Fagaceae,105674,195098,Active,Quercus garryana var. breweri,Oregon white oak,,Present
YOSE,Yosemite National Park,Vascular Plant,6,Fagales,Fagaceae,104394,19366,Active,Quercus kelloggii,California black oak,,Present
YOSE,Yosemite National Park,Vascular Plant,6,Fagales,Fagaceae,105103,19370,Active,Quercus lobata,"California white oak, valley oak",,Present
YOSE,Yosemite National Park,Vascular Plant,6,Fagales,Fagaceae,100170,19445,Active,Quercus vaccinifolia,,,Present
YOSE,Yosemite National Park,Vascular Plant,6,Fagales,Fagaceae,217817,529963,Active,Quercus wislizeni var. wislizeni,interior live oak,,Present
YOSE,Yosemite National Park,Vascular Plant,6,Fagales,Myricaceae,96362,19266,Active,Myrica hartwegii,"Sierra bayberry, Sierra sweet-bay",,Present
YOSE,Yosemite National Park,Vascular Plant,6,Garryales,Garryaceae,157398,502731,Active,Garrya fremontii,bearbrush,,Present
YOSE,Yosemite National Park,Vascular Plant,6,Gentianales,Apocynaceae,130899,30156,Active,Apocynum androsaemifolium,"bitterroot, flytrap dogbane, spreading dogbane",,Present
YOSE,Yosemite National Park,Vascular Plant,6,Gentianales,Apocynaceae,130900,30157,Active,Apocynum cannabinum,"common dogbane, dogbane, hemp dogbane, Indian hemp, Indian-hemp, prairie dogbane",,Present
YOSE,Yosemite National Park,Vascular Plant,6,Gentianales,Apocynaceae,131810,30256,Active,Asclepias cordifolia,"heartleaf milkweed, purple milkweed",,Present
YOSE,Yosemite National Park,Vascular Plant,6,Gentianales,Apocynaceae,131822,30267,Active,Asclepias fascicularis,"Mexican whorled milkweed, narrowleaf milkweed, narrow-leaved milkweed",,Present
YOSE,Yosemite National Park,Vascular Plant,6,Gentianales,Apocynaceae,131864,30304,Active,Asclepias speciosa,showy milkweed,,Present
YOSE,Yosemite National Park,Vascular Plant,6,Gentianales,Apocynaceae,130989,30237,Active,Vinca major,"bigleaf periwinkle, greater periwinkle, periwinkle",,Present
YOSE,Yosemite National Park,Vascular Plant,6,Gentianales,Gentianaceae,129037,30041,Active,Centaurium venustum,charming centaury,,Present
YOSE,Yosemite National Park,Vascular Plant,6,Gentianales,Gentianaceae,128158,29972,Active,Gentiana calycosa,"mountain bog gentian, Rainier pleated gentian",,Present
YOSE,Yosemite National Park,Vascular Plant,6,Gentianales,Gentianaceae,212311,528225,Active,Gentiana newberryi var. tiogana,Tioga gentian,,Present
YOSE,Yosemite National Park,Vascular Plant,6,Gentianales,Gentianaceae,129058,30060,Active,Gentianella amarella ssp. acuta,"autumn dwarf gentian, autumn dwarfgentian, autumn dwarf-gentian",,Present
YOSE,Yosemite National Park,Vascular Plant,6,Gentianales,Gentianaceae,129073,30074,Active,Gentianella tenella ssp. tenella,"Dane's dwarf gentian, Dane's dwarfgentian",,Present
YOSE,Yosemite National Park,Vascular Plant,6,Gentianales,Gentianaceae,129084,30084,Active,Gentianopsis holopetala,"Sierra fringed gentian, Sierra gentian",,Present
YOSE,Yosemite National Park,Vascular Plant,6,Gentianales,Gentianaceae,129089,30089,Active,Gentianopsis simplex,"oneflower fringed gentian, oneflower gentian",,Present
YOSE,Yosemite National Park,Vascular Plant,6,Gentianales,Gentianaceae,129122,30118,Active,Swertia perennis,"alpinebog swertia, felwort, star gentian",,Present
YOSE,Yosemite National Park,Vascular Plant,6,Gentianales,Gentianaceae,130860,30120,Active,Swertia radiata,,,Present
YOSE,Yosemite National Park,Vascular Plant,6,Gentianales,Rubiaceae,220416,533288,Active,Cephalanthus occidentalis var. californicus,,,Present
YOSE,Yosemite National Park,Vascular Plant,6,Gentianales,Rubiaceae,137982,34797,Active,Galium aparine,"bedstraw, catchweed bedstraw, cleavers, cleaverwort, goose grass, scarthgrass, stickywilly, sticky-willy, white hedge",,Present
YOSE,Yosemite National Park,Vascular Plant,6,Gentianales,Rubiaceae,138015,34826,Active,Galium bifolium,"twinleaf bedstraw, twin-leaf bedstraw",,Present
YOSE,Yosemite National Park,Vascular Plant,6,Gentianales,Rubiaceae,138016,34827,Active,Galium bolanderi,Bolander's bedstraw,,Present
YOSE,Yosemite National Park,Vascular Plant,6,Gentianales,Rubiaceae,207917,525785,Active,Galium boreale ssp. septentrionale,,,Present
YOSE,Yosemite National Park,Vascular Plant,6,Gentianales,Rubiaceae,224296,535618,Active,Galium mexicanum var. asperulum,Mexican bedstraw,Galium mexicanum ssp. asperulum,Present
YOSE,Yosemite National Park,Vascular Plant,6,Gentianales,Rubiaceae,138768,34905,Active,Galium parisiense,wall bedstraw,,Present
YOSE,Yosemite National Park,Vascular Plant,6,Gentianales,Rubiaceae,212292,528216,Active,Galium porrigens var. tenue,graceful bedstraw,,Present
YOSE,Yosemite National Park,Vascular Plant,6,Gentianales,Rubiaceae,138789,34924,Active,Galium sparsiflorum ssp. sparsiflorum,Sequoia bedstraw,,Present
YOSE,Yosemite National Park,Vascular Plant,6,Gentianales,Rubiaceae,224921,535660,Active,Galium trifidum var. pacificum,"threepetal bedstraw, three-petal bedstraw",Galium trifidum ssp. subbiflorum,Present
YOSE,Yosemite National Park,Vascular Plant,6,Gentianales,Rubiaceae,224923,535661,Active,Galium trifidum var. pusillum,,,Present
YOSE,Yosemite National Park,Vascular Plant,6,Gentianales,Rubiaceae,138799,34933,Active,Galium triflorum,"fragrant bedstraw, sweet bedstraw, sweetscented bedstraw",,Present
YOSE,Yosemite National Park,Vascular Plant,6,Gentianales,Rubiaceae,139739,35061,Active,Kelloggia galioides,"milk kelloggia, milky kelloggia",,Present
YOSE,Yosemite National Park,Vascular Plant,6,Geraniales,Geraniaceae,130116,29146,Active,Erodium botrys,longbeak stork's bill,,Present
YOSE,Yosemite National Park,Vascular Plant,6,Geraniales,Geraniaceae,157036,502424,Active,Erodium brachycarpum,shortfruit stork's bill,,Present
YOSE,Yosemite National Park,Vascular Plant,6,Geraniales,Geraniaceae,130117,29147,Active,Erodium cicutarium,"alfilaree, alfilaria, California filaree, cutleaf filaree, filaree, redstem filaree, redstem stork's bill, stork's bill",,Present
YOSE,Yosemite National Park,Vascular Plant,6,Geraniales,Geraniaceae,130100,29131,Active,Geranium californicum,California cranesbill,,Present
YOSE,Yosemite National Park,Vascular Plant,6,Geraniales,Geraniaceae,130071,29105,Active,Geranium carolinianum,"Carolina crane's-bill, Carolina geranium",,Present
YOSE,Yosemite National Park,Vascular Plant,6,Geraniales,Geraniaceae,130104,29135,Active,Geranium dissectum,cutleaf geranium,,Present
YOSE,Yosemite National Park,Vascular Plant,6,Geraniales,Geraniaceae,130085,29118,Active,Geranium richardsonii,Richardson's geranium,,Present
YOSE,Yosemite National Park,Vascular Plant,6,Geraniales,Geraniaceae,130086,29119,Active,Geranium robertianum,Robert's geranium,,Present
YOSE,Yosemite National Park,Vascular Plant,6,Isoetales,Isoetaceae,77854,17121,Active,Isoetes bolanderi,Bolander's quillwort,,Present
YOSE,Yosemite National Park,Vascular Plant,6,Isoetales,Isoetaceae,77954,17130,Active,Isoetes howellii,Howell's quillwort,,Present
YOSE,Yosemite National Park,Vascular Plant,6,Isoetales,Isoetaceae,78701,17137,Active,Isoetes nuttallii,Nuttall's quillwort,,Present
YOSE,Yosemite National Park,Vascular Plant,6,Isoetales,Isoetaceae,91237,181781,Active,Isoetes occidentalis,western quillwort,,Present
YOSE,Yosemite National Park,Vascular Plant,6,Lamiales,Lamiaceae,135557,32450,Active,Agastache urticifolia,"horsemint giant hyssop, nettleleaf giant hyssop",,Present
YOSE,Yosemite National Park,Vascular Plant,6,Lamiales,Lamiaceae,158097,502801,Active,Glechoma hederacea,"creeping charlie, gill-over-the-ground, ground ivy, groundivy, haymaids",,Present
YOSE,Yosemite National Park,Vascular Plant,6,Lamiales,Lamiaceae,136456,32539,Active,Lamium amplexicaule,"common henbit, giraffehead, henbit, henbit deadnettle",,Present
YOSE,Yosemite National Park,Vascular Plant,6,Lamiales,Lamiaceae,136471,32552,Active,Lepechinia calycina,woodbalm,,Present
YOSE,Yosemite National Park,Vascular Plant,6,Lamiales,Lamiaceae,134016,32257,Active,Lycopus uniflorus,"bugleweed, northern bugleweed, northern water-horehound, oneflower bugleweed",,Present
YOSE,Yosemite National Park,Vascular Plant,6,Lamiales,Lamiaceae,136481,32561,Active,Marrubium vulgare,"horehound, white horehound",,Present
YOSE,Yosemite National Park,Vascular Plant,6,Lamiales,Lamiaceae,289323,565302,Active,Mentha arvensis,"field mint, wild mint",,Present
YOSE,Yosemite National Park,Vascular Plant,6,Lamiales,Lamiaceae,159030,-502584,Inactive,Mentha spicata var. spicata,,,Present
YOSE,Yosemite National Park,Vascular Plant,6,Lamiales,Lamiaceae,171383,508123,Active,Monardella glauca,"blue monardella, gray monardella, pale monardella",,Present
YOSE,Yosemite National Park,Vascular Plant,6,Lamiales,Lamiaceae,136531,32606,Active,Monardella lanceolata,"mustang mint, mustang monardella, mustang mountainbalm",,Present
YOSE,Yosemite National Park,Vascular Plant,6,Lamiales,Lamiaceae,136507,32585,Active,Monardella odoratissima ssp. pallida,"alpine mountainbalm, mountain monardella",,Present
YOSE,Yosemite National Park,Vascular Plant,6,Lamiales,Lamiaceae,167838,507861,Active,Monardella sheltonii,Shelton's monardella,,Present
YOSE,Yosemite National Park,Vascular Plant,6,Lamiales,Lamiaceae,233878,539276,Active,Prunella vulgaris var. lanceolata,,,Present
YOSE,Yosemite National Park,Vascular Plant,6,Lamiales,Lamiaceae,137519,32658,Active,Pycnanthemum californicum,Sierra mint,,Present
YOSE,Yosemite National Park,Vascular Plant,6,Lamiales,Lamiaceae,128631,32707,Active,Salvia columbariae,chia,,Present
YOSE,Yosemite National Park,Vascular Plant,6,Lamiales,Lamiaceae,128720,32788,Active,Scutellaria bolanderi ssp. bolanderi,Sierra skullcap,Scutellaria bolanderi,Present
YOSE,Yosemite National Park,Vascular Plant,6,Lamiales,Lamiaceae,129286,32815,Active,Scutellaria siphocampyloides,grayleaf skullcap,,Present
YOSE,Yosemite National Park,Vascular Plant,6,Lamiales,Lamiaceae,128710,32779,Active,Scutellaria tuberosa,Danny's skullcap,,Present
YOSE,Yosemite National Park,Vascular Plant,6,Lamiales,Lamiaceae,218740,531390,Active,Stachys ajugoides var. rigida,,,Present
YOSE,Yosemite National Park,Vascular Plant,6,Lamiales,Lamiaceae,134868,32312,Active,Stachys albens,"white hedgenettle, whitestem hedgenettle",,Present
YOSE,Yosemite National Park,Vascular Plant,6,Lamiales,Lamiaceae,134935,32373,Active,Trichostema lanceolatum,vinegarweed,,Present
YOSE,Yosemite National Park,Vascular Plant,6,Lamiales,Lamiaceae,134937,32375,Active,Trichostema oblongum,oblong bluecurls,,Present
YOSE,Yosemite National Park,Vascular Plant,6,Lamiales,Lentibulariaceae,135334,34452,Active,Utricularia gibba,"conespur bladderpod, humped bladderwort",,Present
YOSE,Yosemite National Park,Vascular Plant,6,Lamiales,Lentibulariaceae,135336,34454,Active,Utricularia intermedia,"flatleaf bladderwort, flat-leaf bladderwort, mountain bladderwort",,Present
YOSE,Yosemite National Park,Vascular Plant,6,Lamiales,Lentibulariaceae,135339,34457,Active,Utricularia minor,lesser bladderwort,,Probably Present
YOSE,Yosemite National Park,Vascular Plant,6,Lamiales,Lentibulariaceae,135326,34445,Active,Utricularia vulgaris,,,Present
YOSE,Yosemite National Park,Vascular Plant,6,Lamiales,Linderniaceae,215877,528804,Active,Lindernia dubia var. anagallidea,"false pimpernel, yellowseed false pimpernel, yellow-seed false pimpernel",,Present
YOSE,Yosemite National Park,Vascular Plant,6,Lamiales,Oleaceae,129683,32932,Active,Fraxinus dipetala,"California ash, two-petal ash",,Present
YOSE,Yosemite National Park,Vascular Plant,6,Lamiales,Oleaceae,129696,32944,Active,Fraxinus latifolia,Oregon ash,,Present
YOSE,Yosemite National Park,Vascular Plant,6,Lamiales,Orobanchaceae,204032,525153,Active,Castilleja applegatei ssp. disticha,wavyleaf Indian paintbrush,,Present
YOSE,Yosemite National Park,Vascular Plant,6,Lamiales,Orobanchaceae,204036,525155,Active,Castilleja applegatei ssp. pallida,wavyleaf Indian paintbrush,,Present
YOSE,Yosemite National Park,Vascular Plant,6,Lamiales,Orobanchaceae,204038,525156,Active,Castilleja applegatei ssp. pinetorum,wavyleaf Indian paintbrush,,Present
YOSE,Yosemite National Park,Vascular Plant,6,Lamiales,Orobanchaceae,163843,506876,Active,Castilleja attenuata,"attenuate Indian paintbrush, Indian paintbrush",,Present
YOSE,Yosemite National Park,Vascular Plant,6,Lamiales,Orobanchaceae,205692,524900,Active,Castilleja densiflora ssp. densiflora,denseflower Indian paintbrush,,Present
YOSE,Yosemite National Park,Vascular Plant,6,Lamiales,Orobanchaceae,205698,524903,Active,Castilleja exserta ssp. exserta,"exserted Indian paintbrush, owl clover",,Present
YOSE,Yosemite National Park,Vascular Plant,6,Lamiales,Orobanchaceae,131208,33117,Active,Castilleja foliolosa,Texas Indian paintbrush,,Present
YOSE,Yosemite National Park,Vascular Plant,6,Lamiales,Orobanchaceae,163856,506882,Active,Castilleja lacera,cutleaf Indian paintbrush,,Present
YOSE,Yosemite National Park,Vascular Plant,6,Lamiales,Orobanchaceae,130368,33067,Active,Castilleja lemmonii,"Lemmon's Indian paintbrush, Lemmon's paintbrush",,Present
YOSE,Yosemite National Park,Vascular Plant,6,Lamiales,Orobanchaceae,768423,-9798291,Active,Castilleja lineariloba,sagebrush Indian paintbrush,Castilleja lineariiloba,Present
YOSE,Yosemite National Park,Vascular Plant,6,Lamiales,Orobanchaceae,204049,525161,Active,Castilleja miniata ssp. miniata,"giant red Indian paintbrush, great red Indian paintbrush, great red Indian-paintbrush, scarlet Indian paintbrush, scarlet paintbrush",Castilleja miniata,Present
YOSE,Yosemite National Park,Vascular Plant,6,Lamiales,Orobanchaceae,204053,525163,Active,Castilleja minor ssp. spiralis,"annual Indian paintbrush, lesser Indian paintbrush",,Present
YOSE,Yosemite National Park,Vascular Plant,6,Lamiales,Orobanchaceae,130373,33071,Active,Castilleja nana,"dwarf alpine Indian paintbrush, dwarf alpine paintbrush",,Present
YOSE,Yosemite National Park,Vascular Plant,6,Lamiales,Orobanchaceae,133863,33154,Active,Castilleja parviflora,mountain Indian paintbrush,,Present
YOSE,Yosemite National Park,Vascular Plant,6,Lamiales,Orobanchaceae,130378,33076,Active,Castilleja pilosa,"hairy paintbrush, parrothead Indian paintbrush",,Present
YOSE,Yosemite National Park,Vascular Plant,6,Lamiales,Orobanchaceae,163866,506887,Active,Castilleja tenuis,"hairy Indian paintbrush, slender paintbrush",,Present
YOSE,Yosemite National Park,Vascular Plant,6,Lamiales,Orobanchaceae,137901,33550,Active,Cordylanthus rigidus ssp. brevibracteatus,stiffbranch bird's beak,,Present
